sentence,translation,translation_extra
The petals fall with the next puff of wind.,"With the next puff of wind, the petals fall.","With the next puff of wind, the petals fall. Yes, hrrmmm."
Bring your best compass to the third class.,"To the third class, bring your best compass, you must.","To the third class, bring your best compass, you must. Hrmmm."
They could laugh although they were sad.,"Although they were sad, laugh they could.","Although they were sad, laugh they could. Yes, hrrmmm."
Farmers came in to thresh the oat crop.,"To thresh the oat crop, farmers came in.","To thresh the oat crop, farmers came in. Hrmmm."
The brown house was on fire to the attic.,"To the attic, the brown house on fire was.","To the attic, the brown house on fire was. Hmm."
The lure is used to catch trout and flounder.,"To catch trout and flounder, the lure is used.","To catch trout and flounder, the lure is used."
Float the soap on top of the bath water.,"On top of the bath water, float the soap, you must.","On top of the bath water, float the soap, you must."
A blue crane is a tall wading bird.,"A tall wading bird, a blue crane is.","A tall wading bird, a blue crane is."
A fresh start will work such wonders.,"Such wonders, a fresh start will work.","Such wonders, a fresh start will work."
The club rented the rink for the fifth night.,"For the fifth night, the club the rink rented.","For the fifth night, the club the rink rented."
After the dance they went straight home.,"After the dance, straight home they went.","After the dance, straight home they went."
The hostess taught the new maid to serve.,"The new maid to serve, the hostess taught.","The new maid to serve, the hostess taught."
He wrote his last novel there at the inn.,"There at the inn, his last novel, he wrote.","There at the inn, his last novel, he wrote."
Even the worst will beat his low score.,"Will beat his low score, even the worst will.","Will beat his low score, even the worst will. Yrsssss."
The cement had dried when he moved it.,"Had dried when he moved it, the cement had.","Had dried when he moved it, the cement had. Hrmmm."
The loss of the second ship was hard to take.,"Hard to take, the loss of the second ship was.","Hrrmmm. Hard to take, the loss of the second ship was."
The fly made its way along the wall.,"Along the wall, the fly its way made.","Along the wall, the fly its way made."
Do that with a wooden stick.,"With a wooden stick, do that, you must.","With a wooden stick, do that, you must."
Lire wires should be kept covered.,"Kept covered, live wires should be.","Kept covered, live wires should be. Hmm."
The large house had hot water taps.,"Had hot water taps, the large house did.","Had hot water taps, the large house did. Hmm."
It is hard to erase blue or red ink.,"To erase blue or red ink, hard it is.","To erase blue or red ink, hard it is. Yes, hrrmmm."
Write at once or you may forget it.,"At once, write, or forget it you may.","At once, write, or forget it you may."
The doorknob was made of bright clean brass.,"Made of bright clean brass, the doorknob was.","Made of bright clean brass, the doorknob was. Yes, hrrrm."
The wreck occurred by the bank on Main Street.,"By the bank on Main Street, the wreck occurred.","By the bank on Main Street, the wreck occurred."
A pencil with black lead writes best.,"With black lead, a pencil writes best.","With black lead, a pencil writes best."
Coax a young calf to drink from a bucket.,"To drink from a bucket, coax a young calf, you must.","To drink from a bucket, coax a young calf, you must."
Schools for ladies teach charm and grace.,"Teach charm and grace, schools for ladies do.","Teach charm and grace, schools for ladies do. Hmm."
The lamp shone with a steady green flame.,"With a steady green flame, the lamp shone.","With a steady green flame, the lamp shone. Hmm."
They took the axe and the saw to the forest.,"To the forest, the axe and the saw, they took.","To the forest, the axe and the saw, they took. Yes, hrrrm."
The ancient coin was quite dull and worn.,"Quite dull and worn, the ancient coin was.","Quite dull and worn, the ancient coin was."
The shaky barn fell with a loud crash.,"With a loud crash, the shaky barn fell.","With a loud crash, the shaky barn fell."
Jazz and swing fans like fast music.,"Like fast music, jazz and swing fans do.","Like fast music, jazz and swing fans do."
Rake the rubbish up and then burn it.,"The rubbish up rake, and then burn it, you must.","The rubbish up rake, and then burn it, you must. Yes, hrrrm."
Slash the gold cloth into fine ribbons.,"Into fine ribbons, slash the gold cloth, you must.","Into fine ribbons, slash the gold cloth, you must."
Try to have the court decide the case.,"Decide the case, have the court, try to.","Decide the case, have the court, try to."
They are pushed back each time they attack.,"Each time they attack, pushed back they are.","Each time they attack, pushed back they are."
He broke his ties with groups of former friends.,"With groups of former friends, his ties, he broke.","With groups of former friends, his ties, he broke."
They floated on the raft to sun their white backs.,"To sun their white backs, on the raft, they floated.","To sun their white backs, on the raft, they floated. Yes, hrrrm."
The map had an X that meant nothing.,"An X that meant nothing, the map had.","Hrrmmm. An X that meant nothing, the map had. Yes, hrrrm."
Whitings are small fish caught in nets.,"Caught in nets, small fish, whitings are.","Caught in nets, small fish, whitings are. Yes, hrrmmm."
Some ads serve to cheat buyers.,"Serve to cheat buyers, some ads do.","Serve to cheat buyers, some ads do."
Jerk the rope and the bell rings weakly.,"The rope jerk, and weakly the bells, ring.","The rope jerk, and weakly the bells, ring. Hmm."
A waxed floor makes us lose balance.,"Makes us lose balance, a waxed floor does.","Hrrmmm. Makes us lose balance, a waxed floor does."
"Madam, this is the best brand of corn.","The best brand of corn, this is, madam.","The best brand of corn, this is, madam."
On the islands the sea breeze is soft and mild.,"On the islands, soft and mild, the sea breeze is.","Hrrmmm. On the islands, soft and mild, the sea breeze is. Yes, hrrmmm."
The play began as soon as we sat down.,"As soon as we sat down, the play began.","As soon as we sat down, the play began. Hmm."
This will lead the world to more sound and fury,"To more sound and fury, lead the world, this will.","To more sound and fury, lead the world, this will. Yrsssss."
Add salt before you fry the egg.,"Before you fry the egg, add salt, you must.","Before you fry the egg, add salt, you must."
The rush for funds reached its peak Tuesday.,"Reached its peak Tuesday, the rush for funds did.","Reached its peak Tuesday, the rush for funds did."
The birch looked stark white and lonesome.,"Stark white and lonesome, the birch looked.","Stark white and lonesome, the birch looked."
The box is held by a bright red snapper.,"By a bright red snapper, the box is held.","By a bright red snapper, the box is held."
"To make pure ice, you freeze water.","o make pure ice, freeze water, you must.","o make pure ice, freeze water, you must. Yes, hrrrm."
The first worm gets snapped early.,"Gets snapped early, the first worm does.","Gets snapped early, the first worm does."
Jump the fence and hurry up the bank.,"The fence jump, and up the the bank hurry.","The fence jump, and up the the bank hurry. Yes, hrrmmm."
Yell and clap as the curtain slides back.,"As the curtain slides back, yell and clap, you must.","As the curtain slides back, yell and clap, you must."
They are men nho walk the middle of the road.,"Walk the middle of the road, they are men who do.","Walk the middle of the road, they are men who do."
Both brothers wear the same size.,"Wear the same size, both brothers do.","Wear the same size, both brothers do. Hmm."
In some forin or other we need fun.,"In some form or other, fun we need.","In some form or other, fun we need."
The prince ordered his head chopped off.,"Ordered his head chopped off, the prince did.","Ordered his head chopped off, the prince did. Yes, hrrrm."
The houses are built of red clay bricks.,"Built of red clay bricks, the houses are.","Built of red clay bricks, the houses are."
Ducks fly north but lack a compass.,"Fly north but lack a compass, ducks do.","Hrrmmm. Fly north but lack a compass, ducks do. Yes, hrrrm."
Fruit flavors are used in fizz drinks.,"In fizz drinks, fruit flavors are used.","In fizz drinks, fruit flavors are used."
These pills do less good than others.,"Do less good than others, these pills do.","Do less good than others, these pills do."
Canned pears lack full flavor.,"Lack full flavor, canned pears do.","Lack full flavor, canned pears do. Yrsssss."
The dark pot hung in the front closet.,"Hung in the front closet, the dark pot was.","Hung in the front closet, the dark pot was. Yrsssss."
Carry the pail to the wall and spill it there.,"To the wall and spill it there, carry the pail, you must.","To the wall and spill it there, carry the pail, you must. Hmm."
The train brought our hero to the big town.,"To the big town, our hero, the train brought.","To the big town, our hero, the train brought."
We are sure that one war is enough.,"One war, enough is, sure, we are.","One war, enough is, sure, we are."
Gray paint stretched for miles around.,"For miles around, gray paint stretched.","For miles around, gray paint stretched."
The rude laugh filled the empty room.,"Filled the empty room, the rude laugh did.","Hrrmmm. Filled the empty room, the rude laugh did."
High seats are best for football fans.,"Best for football fans, high seats are.","Best for football fans, high seats are. Yes, hrrmmm."
Tea served from the brown jug is tasty.,"From the brown jug, tasty, tea served is.","From the brown jug, tasty, tea served is. Yes, hrrrm."
A dash of pepper spoils beef stew.,"Spoils beef stew, a dash of pepper does.","Hrrmmm. Spoils beef stew, a dash of pepper does. Yes, hrrmmm."
A zestful food is the hot-cross bun.,"The hot-cross bun, a zestful food it is.","The hot-cross bun, a zestful food it is. Yes, hrrrm."
The horse trotted around the field at a brisk pace.,"At a brisk pace, around the field, the horse trotted.","At a brisk pace, around the field, the horse trotted."
Find the twin who stole the pearl necklace.,"Who stole the pearl necklace, find the twin, you must.","Who stole the pearl necklace, find the twin, you must. Yes, hrrrm."
Cut the cord that binds the box tightly.,"That binds the box tightly, cut the cord, you must.","That binds the box tightly, cut the cord, you must. Yes, hrrrm."
The red tape bound the smuggled food.,"Bound the smuggled food, the red tape did.","Bound the smuggled food, the red tape did."
Look in the corner to find the tan shirt.,"To find the tan shirt, look in the corner, you must.","To find the tan shirt, look in the corner, you must."
The cold drizzle will halt the bond drive.,"Will halt the bond drive, the cold drizzle will.","Will halt the bond drive, the cold drizzle will."
Nine men were hired to dig the ruins.,"To dig the ruins, hired, nine men were.","To dig the ruins, hired, nine men were."
The junk yard had a mouldy smell.,"Had a mouldy smell, the junk yard did.","Had a mouldy smell, the junk yard did."
The flint sputtered and lit a pine torch.,"A pine torch, the flint sputtered and lit.","A pine torch, the flint sputtered and lit. Hrmmm."
Soak the cloth and drown the sharp odor.,"To drown the sharp odor, soak the cloth, you must.","To drown the sharp odor, soak the cloth, you must. Yes, hrrrm."
The shelves were bare of both jam or crackers.,"Of both jam or crackers, the shelves were bare.","Of both jam or crackers, the shelves were bare. Hmm."
A joy to every child is the swan boat.,"To every child, a joy, the swan boat is.","To every child, a joy, the swan boat is. Hmm."
All sat frozen and watched the screen.,"The screen, all sat frozen and watched.","The screen, all sat frozen and watched. Hmm."
ii cloud of dust stung his tender eyes.,"Stung his tender eyes, a cloud of dust did.","Stung his tender eyes, a cloud of dust did. Yrsssss."
To reach the end he needs much courage.,"To reach the end, much courage he needs.","To reach the end, much courage he needs."
Shape the clay gently into block form.,"Gently into block form, shape the clay, you must.","Gently into block form, shape the clay, you must. Yes, hrrmmm."
The ridge on a smooth surface is a bump or flaw.,"A bump or flaw, the ridge on a smooth surface is.","A bump or flaw, the ridge on a smooth surface is."
Hedge apples may stain your hands green.,"May stain your hands green, hedge apples do.","May stain your hands green, hedge apples do."
"Quench your thirst, then eat the crackers.","Your thirst, quench, and then the crackers, eat.","Your thirst, quench, and then the crackers, eat."
Tight curls get limp on rainy days.,"On rainy days, tight curls get limp.","On rainy days, tight curls get limp. Yes, hrrrm."
The mute muffled the high tones of the horn.,"Muffled the high tones of the horn, the mute did.","Muffled the high tones of the horn, the mute did."
The gold ring fits only a pierced ear.,"Fits only a pierced ear, the gold ring does.","Fits only a pierced ear, the gold ring does."
The old pan was covered with hard fudge.,"Covered with hard fudge, the old pan was.","Covered with hard fudge, the old pan was."
Watch the log float in the wide river.,"Float in the wide river, watch the log, you must.","Hrrmmm. Float in the wide river, watch the log, you must."
The node on the stalk of wheat grew daily.,"On the stalk of wheat, the node grew daily.","On the stalk of wheat, the node grew daily."
The heap of fallen leaves was set on fire.,"Set on fire, the heap of fallen leaves was.","Hrrmmm. Set on fire, the heap of fallen leaves was."
"Write fast, if you want to finish early.","If you want to finish early, write fast, you must.","Hrrmmm. If you want to finish early, write fast, you must."
His shirt was clean but one button was gone.,"Clea, his shirt was, but one button, gone, was.","Clea, his shirt was, but one button, gone, was."
The barrel of beer was a brew of malt and hops.,"A brew of malt and hops, the barrel of beer was.","A brew of malt and hops, the barrel of beer was."
Tin cans are absent from store shelves.,"Absent from store shelves, tin cans are.","Absent from store shelves, tin cans are."
Slide the box into that empty space.,"Into that empty space, slide the box, you must.","Into that empty space, slide the box, you must. Hmm."
The plant grew large and green in the window.,"Large and green in the window, the plant grew.","Large and green in the window, the plant grew."
The beam dropped down on the workmen's head.,"Dropped down on the workmen's head, the beam did.","Dropped down on the workmen's head, the beam did."
Pink clouds floated JTith the breeze.,"Floated with the breeze, pink clouds did.","Floated with the breeze, pink clouds did."
"She danced like a swan, tall and graceful.","Like a swan, tall and graceful, she danced.","Like a swan, tall and graceful, she danced."
The tube was blown and the tire flat and useless.,"Blown was the tube, and flat and useless the tire was.","Hrrmmm. Blown was the tube, and flat and useless the tire was."
It is late morning on the old wall clock.,"On the old wall clock, late morning, it is.","Hrrmmm. On the old wall clock, late morning, it is."
Let's all join as we sing the last chorus.,"As we sing the last chorus, let's all join, you must.","As we sing the last chorus, let's all join, you must."
The last switch cannot be turned off.,"Be turned off, the last switch cannot.","Be turned off, the last switch cannot."
The fight will end in just six minutes.,"In just six minutes, the fight, end, will.","In just six minutes, the fight, end, will."
The store walls were lined with colored frocks.,"Lined with colored frocks, the store walls were.","Lined with colored frocks, the store walls were. Yes, hrrrm."
The peace league met to discuss their plans.,"Met to discuss their plans, the peace league did.","Met to discuss their plans, the peace league did."
The rise to fame of a person takes luck.,"The rise of a person to fame, luck takes.","The rise of a person to fame, luck takes."
"Paper is scarce, so write with much care.","Paper scarce is, so wih much care, write.","Hrrmmm. Paper scarce is, so wih much care, write. Yes, hrrmmm."
The quick fox jumped on the sleeping cat.,"Jumped on the sleeping cat, the quick fox did.","Hrrmmm. Jumped on the sleeping cat, the quick fox did."
The nozzle of the fire hose was bright brass.,"Bright brass, the nozzle of the fire hose was.","Bright brass, the nozzle of the fire hose was. Hmm."
Screw the round cap on as tight as needed.,"On as tight as needed, screw the round cap, you must.","On as tight as needed, screw the round cap, you must. Yrsssss."
Time brings us many changes.,"Many changes, time brings us.","Many changes, time brings us."
The purple tie was ten years old.,"Ten years old, the purple tie was.","Ten years old, the purple tie was."
Men think and plan and sometimes act.,"Think and plan lan and sometimes act, men do.","Hrrmmm. Think and plan lan and sometimes act, men do."
Fill the ink jar with sticky glue.,"With sticky glue, fill the ink jar, you must.","With sticky glue, fill the ink jar, you must."
He smoke a big pipe with strong contents.,"A big pipe with strong contents, he smoke.","A big pipe with strong contents, he smoke. Yrsssss."
We need grain to keep our mules healthy.,"To keep our mules healthy, grain, we need.","To keep our mules healthy, grain, we need."
Pack the records in a neat thin case.,"In a neat thin case, pack the records, you must.","In a neat thin case, pack the records, you must."
The crunch of feet in the snow was the only sound.,"The only sound, the crunch of feet in the snow was.","The only sound, the crunch of feet in the snow was. Yes, hrrmmm."
The copper bowl shone in the sun's rays.,"Shone in the sun's rays, the copper bowl did.","Shone in the sun's rays, the copper bowl did."
Boards will warp unless kept dry.,"Unless kept dry, warp, boards will.","Unless kept dry, warp, boards will."
The plush chair leaned against the wall.,"Leaned against the wall, the plush chair did.","Leaned against the wall, the plush chair did. Yes, hrrrm."
Glass will clink when struck by metal.,"When struck by metal, glass, clink, will.","Hrrmmm. When struck by metal, glass, clink, will. Hrmmm."
Bathe and relax in the cool green grass.,"In the cool green grass, bathe and relax, you must.","In the cool green grass, bathe and relax, you must."
Nine rows of soldiers stood in line.,"Stood in line, nine rows of soldiers did.","Stood in line, nine rows of soldiers did."
The beach is dry and shallow at low tide.,"Dry and shallow at low tide, the beach is.","Dry and shallow at low tide, the beach is."
The idea is to sew both edges straight.,"To sew both edges straight, the idea is.","To sew both edges straight, the idea is. Yrsssss."
The kitten chased the dog down the street.,"Chased the dog down the street, the kitten did.","Chased the dog down the street, the kitten did. Yes, hrrrm."
Pages bound in cloth make a book.,"A book, pages bound in cloth, make.","A book, pages bound in cloth, make. Yes, hrrrm."
Try to trace the fine lines of the painting.,"The fine lines of the painting, try to trace, you must.","The fine lines of the painting, try to trace, you must. Yes, hrrmmm."
Women form less than half of the group.,"Less than half of the group, women form.","Less than half of the group, women form."
The zones merge in the central part of town.,"In the central part of town, the zones merge.","In the central part of town, the zones merge."
A gem in the rough needs work to polish.,"Work to polish, a gem in the rough needs.","Work to polish, a gem in the rough needs."
Code is used when secrets are sent.,"When secrets are sent, code is used.","When secrets are sent, code is used."
Most of the new is easy for us to hear.,"Easy for us to hear, most of the news is.","Easy for us to hear, most of the news is."
He used the lathe to make brass objects.,"To make brass objects, the lathe, he used.","To make brass objects, the lathe, he used. Yes, hrrrm."
The vane on top of the pole revolved in the wind.,"In the wind, the vane on top of the pole revolved.","In the wind, the vane on top of the pole revolved."
Mince pie is a dish served to children.,"A dish served to children, mince pie is.","A dish served to children, mince pie is."
The clan gathered on each dull night.,"On each dull night, the clan gathered.","Hrrmmm. On each dull night, the clan gathered."
"Let it burn, it gives us warmth and comfort.","Let it burn, you must, warmth and comfort it gives us.","Let it burn, you must, warmth and comfort it gives us."
A castle built from sand fails to endure.,"Fails to endure, a castle built from sand does.","Fails to endure, a castle built from sand does."
A child's wit saved the day for us.,"Saved the day for us, a child's wit did.","Saved the day for us, a child's wit did."
Tack the strip of carpet to the worn floor.,"To the worn floor, tack the strip of carpet, you must.","To the worn floor, tack the strip of carpet, you must."
Next Tuesday we must vote.,"Next Tuesday, vote we must.","Next Tuesday, vote we must."
Pour the stew from the pot into the plate.,"From the pot into the plate, pour the stew, you must.","From the pot into the plate, pour the stew, you must."
Each penny shone like new.,"Shone like new, each penny did.","Shone like new, each penny did. Hrmmm."
The man went to the woods to gather sticks.,"To gather sticks, to the woods, the man went.","To gather sticks, to the woods, the man went."
The dirt piles were lines along the road.,"Lined along the road, the dirt piles were.","Lined along the road, the dirt piles were."
The logs fell and tumbled into the clear stream.,"Fell and tumbled into the clear stream, the logs did.","Fell and tumbled into the clear stream, the logs did. Yrsssss."
"Just hoist it up and take it away,","Just hoist it up, you must, and away take it.","Just hoist it up, you must, and away take it."
A ripe plum is fit for a king's palate.,"Fit for a king's palate, a ripe plum is.","Fit for a king's palate, a ripe plum is."
Our plans right now are hazy.,"Right now, hazy, our plans are.","Right now, hazy, our plans are. Yes, hrrmmm."
Brass rings are sold by these natives.,"By these natives, brass rings are sold.","By these natives, brass rings are sold."
It takes a good trap to capture a bear.,"To capture a bear, a good trap, it takes.","To capture a bear, a good trap, it takes."
Feed the white mouse some flower seeds.,"Some flower seeds, feed the white mouse, you must.","Some flower seeds, feed the white mouse, you must."
The thaw came early and freed the stream.,"Early, the thaw came, and the stream, freed.","Early, the thaw came, and the stream, freed. Yes, hrrmmm."
He took the lead and kept it the whole distance.,"The lead, he took, and the whole distance, he kept it.","The lead, he took, and the whole distance, he kept it."
The key you designed will fit the lock.,"Fit the lock, the key you designed will.","Fit the lock, the key you designed will."
Plead to the council to free the poor thief.,"To free the poor thief, plead to the council, you must.","To free the poor thief, plead to the council, you must. Yes, hrrmmm."
Better hash is made of rare beef.,"Of rare beef, better hash is made.","Of rare beef, better hash is made. Yrsssss."
This plank was made for walking on.,"For walking on, this plank was made.","For walking on, this plank was made."
The lake sparkled in the red hot sun.,"In the red hot sun, the lake sparkled.","Hrrmmm. In the red hot sun, the lake sparkled."
He crawled with care along the ledge.,"With care along the ledge, he crawled.","With care along the ledge, he crawled. Yes, hrrrm."
Tend the sheep while the dog wanders.,"While the dog wanders, tend the sheep, you must.","While the dog wanders, tend the sheep, you must. Hmm."
It takes a lot of help to finish these.,"To finish these, a lot of help, it takes.","Hrrmmm. To finish these, a lot of help, it takes."
Mark the spot with a sign painted red.,"With a sign painted red, mark the spot, you must.","With a sign painted red, mark the spot, you must. Hrmmm."
Take two shares as a fair profit.,"As a fair profit, take two shares, you must.","As a fair profit, take two shares, you must. Yes, hrrmmm."
The fur of cats goes by many names.,"Goes by many names, the fur of cats does.","Goes by many names, the fur of cats does. Hmm."
North winds bring colds and fevers.,"Bring colds and fevers, north winds do.","Bring colds and fevers, north winds do."
He asks no person to vouch for him.,"To vouch for him, he asks no person.","To vouch for him, he asks no person."
Go now and come here later.,"Go now, and here later come, you must.","Go now, and here later come, you must."
A sash of gold silk will trim her dress.,"Trim her dress, a sash of gold silk will.","Trim her dress, a sash of gold silk will. Yrsssss."
Soap can wash most dirt away.,"Most dirt away, soap can wash.","Most dirt away, soap can wash."
That move means the game is over.,"Means the game is over, that move does.","Means the game is over, that move does. Hmm."
He wrote down a long list of items.,"A long list of items, down he wrote.","A long list of items, down he wrote. Hmm."
A siege will crack the strong defense.,"Crack the strong defense, a siege will.","Crack the strong defense, a siege will."
Grape juice and water mix well.,"Mix well, grape juice and water do.","Mix well, grape juice and water do. Hmm."
Roads are paved with sticky tar.,"With sticky tar, roads are paved.","With sticky tar, roads are paved. Hmm."
Fake stones shine but cost little.,"But cost little, fake stones shine.","But cost little, fake stones shine."
