sentence,translation,translation_extra
The drip of the rain made a pleasant sound.,"Made a pleasant sound, the drip of the rain did.","Made a pleasant sound, the drip of the rain did. Hrmmm."
Smoke poured out of every crack.,"Out of every crack, smoke poured.","Out of every crack, smoke poured. Hmm."
Serve the hot rum to the tired heroes.,"To the tired heroes, serve the hot rum, you must.","Hrrmmm. To the tired heroes, serve the hot rum, you must."
Much of the story makes good sense.,"Makes good sense, much of the story does.","Makes good sense, much of the story does. Hmm."
The sun came up to light the eastern sky.,"To light the eastern sky, the sun came up.","To light the eastern sky, the sun came up."
Heave the line over the port side.,"Over the port side, heave the line, you must.","Over the port side, heave the line, you must. Hrmmm."
A lathe cuts and trims any wood.,"Cuts and trims any wood, a lathe does.","Cuts and trims any wood, a lathe does. Hrmmm."
It's a dense crowd in two distinct ways.,"In two distinct ways, a dense crowd, it is.","In two distinct ways, a dense crowd, it is."
His hip struck the knee of the next player.,"The knee of the next player, his hip struck.","The knee of the next player, his hip struck."
The stale smell of old beer lingers.,"Of old beer lingers, the stale smell.","Of old beer lingers, the stale smell."
The desk was firm on the shaky floor.,"On the shaky floor, the desk firm was.","On the shaky floor, the desk firm was. Yes, hrrrm."
It takes heat to bring out the odor.,"To bring out the odor, heat, it takes.","To bring out the odor, heat, it takes."
Beef is scarcer than some lamb.,"Scarcer than some lamb, beef is.","Scarcer than some lamb, beef is."
Raise the sail and steer the ship northward.,"Northward, the ship steer, and raise the sail, you must.","Northward, the ship steer, and raise the sail, you must."
The cone costs five cents on Mondays.,"On Mondays, the cone, five cents, costs.","On Mondays, the cone, five cents, costs. Yes, hrrrm."
A pod is what peas always grow in.,"What peas always grow in, a pod is.","What peas always grow in, a pod is. Yrsssss."
Jerk the dart from the cork target.,"From the cork target, jerk the dart, you must.","From the cork target, jerk the dart, you must. Hrmmm."
No cement will hold hard wood.,"Hold hard wood, no cement will.","Hold hard wood, no cement will."
We now have a new base for shipping.,"A new base for shipping, we now have.","A new base for shipping, we now have."
The list of names is carved around the base.,"Carved around the base, the list of names is.","Carved around the base, the list of names is. Hrmmm."
The sheep were led home by a dog.,"Led home by a dog, the sheep were.","Led home by a dog, the sheep were."
"Three for a dime, the young peddler cried.","Three for a dime, the young peddler cried.","Three for a dime, the young peddler cried."
The sense of smell is better than that of touch.,"Better than that of touch, the sense of smell is.","Better than that of touch, the sense of smell is."
No hardship seemed to keep him sad.,"To keep him sad, no hardship seemed.","To keep him sad, no hardship seemed. Yrsssss."
Grace makes up for lack of beauty.,"For lack of beauty, grace makes up.","For lack of beauty, grace makes up."
Nudge gently but wake her now.,"Gently nudge but wake her now, you must.","Gently nudge but wake her now, you must. Hrmmm."
The news struck doubt into restless minds.,"Into restless minds, the news struck doubt.","Into restless minds, the news struck doubt."
Once we stood beside the shore.,"Beside the shore, once we stood.","Beside the shore, once we stood."
A chink in the wall allowed a draft to blow.,"Allowed a draft to blow, a chink in the wall did.","Allowed a draft to blow, a chink in the wall did. Yes, hrrrm."
Fasten two pins on each side.,"On each side, fasten two pins, you must.","On each side, fasten two pins, you must. Hrmmm."
A cold dip restores health and zest.,"Restores health and zest, a cold dip does.","Restores health and zest, a cold dip does."
He takes the oath of office each March.,"The oath of office each March, he takes.","The oath of office each March, he takes. Hrmmm."
The sand drifts over the sill of the old house.,"Over the sill of the old house, the sand drifts.","Hrrmmm. Over the sill of the old house, the sand drifts. Hrmmm."
The point of the steel pen was bent and twisted.,"Bent and twisted, the point of the steel pen was.","Bent and twisted, the point of the steel pen was. Hrmmm."
There is a lag between thought and act.,"A lag between thought and act, there is.","A lag between thought and act, there is. Yes, hrrrm."
Seed is needed to plant the spring corn.,"To plant the spring corn, seed needed is.","To plant the spring corn, seed needed is."
Draw the chart with heavy black lines.,"With heavy black lines, draw the chart, you must.","With heavy black lines, draw the chart, you must. Yrsssss."
The boy owed his pal thirty cents.,"Owed his pal thirty cents, the boy did.","Owed his pal thirty cents, the boy did."
The chap slipped into the crowd and was lost.,"Into the crowd and was lost, the chap slipped.","Into the crowd and was lost, the chap slipped. Yes, hrrrm."
Hats are worn to tea and not to dinner.,"To tea, hats are worn and not to dinner.","To tea, hats are worn and not to dinner."
The ramp led up to the wide highway.,"Up to the wide highway, the ramp led.","Up to the wide highway, the ramp led."
Beat the dust from the rug onto the lawn.,"Onto the lawn, beat the dust from the rug, you must.","Onto the lawn, beat the dust from the rug, you must."
Say it slowly but make it ring clear.,"Say it slowly but ring it clear, make it.","Say it slowly but ring it clear, make it."
The straw nest housed five robins.,"Housed five robins, the straw nest did.","Housed five robins, the straw nest did. Yes, hrrmmm."
Screen the porch with woven straw mats.,"With woven straw mats, screen the porch, you must.","With woven straw mats, screen the porch, you must. Yes, hrrmmm."
This horse will nose his way to the finish.,"Will nose his way to the finish, this horse will.","Will nose his way to the finish, this horse will. Hmm."
The dry wax protects the deep scratch.,"Protects the deep scratch, the dry wax does.","Protects the deep scratch, the dry wax does."
He picked up the dice for a second roll.,"The dice for a second roll, he picked up.","Hrrmmm. The dice for a second roll, he picked up. Yes, hrrmmm."
These coins will be needed to pay his debt.,"To pay his debt, these coins needed will be.","To pay his debt, these coins needed will be."
The nag pulled the frail cart along.,"Pulled the frail cart along, the nag did.","Pulled the frail cart along, the nag did. Hmm."
Twist the valve and release hot steam.,"The valve twist, and release hot steam, you must.","The valve twist, and release hot steam, you must. Yes, hrrrm."
The vamp of the shoe had a gold buckle.,"Had a gold buckle, the vamp of the shoe did.","Had a gold buckle, the vamp of the shoe did."
The smell of burned rags itches my nose.,"The smell of burned rags, my nose itches.","The smell of burned rags, my nose itches. Hmm."
Xew pants lack cuffs and pockets.,"Lack cuffs and pockets, new pants do.","Lack cuffs and pockets, new pants do."
The marsh will freeze when cold enough.,"When cold enough, the marsh freeze will.","When cold enough, the marsh freeze will. Hmm."
They slice the sausage thin with a knife.,"With a knife, the sausage thin they slice .","Hrrmmm. With a knife, the sausage thin they slice ."
The bloom of the rose lasts a few days.,"Lasts a few days, the bloom of the rose does.","Lasts a few days, the bloom of the rose does."
A gray mare walked before the colt.,"Walked before the colt, a gray mare did.","Walked before the colt, a gray mare did. Yes, hrrmmm."
Breakfast buns are fine with a hot drink.,"Fine with a hot drink, breakfast buns are.","Fine with a hot drink, breakfast buns are. Yes, hrrrm."
Bottles hold four kinds of rum.,"Hold four kinds of rum, bottles do.","Hold four kinds of rum, bottles do. Hmm."
The man wore a feather in his felt hat.,"A feather in his felt hat, the man wore.","A feather in his felt hat, the man wore."
He wheeled the bike past the winding road.,"Past the winding road, the bike he wheeled.","Hrrmmm. Past the winding road, the bike he wheeled. Road the winding.  Yes, hrrmmm."
Drop the ashes on the worn old rug.,"On the worn old rug, drop the ashes, you must.","On the worn old rug, drop the ashes, you must."
The desk and both chairs were painted tan.,"Painted tan, the desk and both chairs were.","Painted tan, the desk and both chairs were."
Throw out the used paper cup and plate.,"The used paper cup and plate, throw out, you must.","The used paper cup and plate, throw out, you must. Yes, hrrmmm."
A clean neck means a neat collar.,"Means a neat collar, a clean neck does.","Hrrmmm. Means a neat collar, a clean neck does. Hrmmm."
The couch cover and hall drapes were blue.,"Blue, the couch cover and hall drapes were.","Blue, the couch cover and hall drapes were."
The stems of the tall glasses cracked and broke.,"Cracked and broke, the stems of the tall glasses did.","Cracked and broke, the stems of the tall glasses did. Yrsssss."
The wall phone rang loud and often.,"Rang loud and often, the wall phone did.","Rang loud and often, the wall phone did. Yes, hrrrm."
The clothes dried on a thin wooden rack.,"On a thin wooden rack, the clothes dried.","On a thin wooden rack, the clothes dried."
Turn on the lantern which gives us light.,"The lantern which gives us light, turn on, you must.","The lantern which gives us light, turn on, you must. Hrmmm."
The cleat sank deeply into the soft turf.,"Into the soft turf, the cleat sank deeply.","Into the soft turf, the cleat sank deeply. Hmm."
The bills were mailed promptly on the tenth of the month.,"Promptly on the tenth of the month, the bills were mailed.","Promptly on the tenth of the month, the bills were mailed."
To have is better than to wait and hope.,"Better than to wait and hope, to have is.","Better than to wait and hope, to have is."
The price is fair for a good antique clock.,"Fair, for a good antique clock, the price is.","Fair, for a good antique clock, the price is."
The music played on while they talked.,"Played on while they talked, the music did.","Played on while they talked, the music did."
Dispense with a vest on a day like this.,"On a day like this, dispense with a vest, you must.","On a day like this, dispense with a vest, you must."
The bunch of grapes was pressed into wine.,"Pressed into wine, the bunch of grapes was.","Pressed into wine, the bunch of grapes was. Yrsssss."
"He sent the figs, but kept the ripe cherries.","The figs, he sent, but the ripe cherries, he kept.","The figs, he sent, but the ripe cherries, he kept."
The hinge on the door creaked with old age.,"Creaked with old age, the hinge on the door did.","Creaked with old age, the hinge on the door did."
The screen before the fire kept in the sparks.,"Kept in the sparks, the screen before the fire did.","Kept in the sparks, the screen before the fire did. Hrmmm."
"Fly by night, and you waste little time.","To little time waste, fly by night, you must.","To little time waste, fly by night, you must. Yes, hrrrm."
Thick glasses helped him read the print.,"Helped him read the print, thick glasses did.","Helped him read the print, thick glasses did. Yes, hrrrm."
Birth and death mark the limits of life.,"Mark the limits of life, birth and death do.","Mark the limits of life, birth and death do. Yrsssss."
The chair looked strong but had no bottom.,"Strong but had no bottom, the chair looked.","Strong but had no bottom, the chair looked."
The kite flew wildly in the high wind.,"In the high wind, the kite wildly flew.","In the high wind, the kite wildly flew."
A fur muff is stylish once more.,"Stylish once more, a fur muff is.","Stylish once more, a fur muff is. Yes, hrrrm."
The tin box held priceless stones.,"Held priceless stones, the tin box did.","Hrrmmm. Held priceless stones, the tin box did. Hmm."
We need an end of all such matter.,"An end of all such matter, we need.","An end of all such matter, we need."
The case was puzzling to the old and wise.,"To the old and wise, puzzling the case was.","To the old and wise, puzzling the case was."
The bright lanterns were gay on the dark lawn.,"On the dark lawn, the bright lanterns were gay.","On the dark lawn, the bright lanterns were gay. Yrsssss."
We don't get much money but we have fun.,Much money we get not but fun we have.,Much money we get not but fun we have.
"The youth drove with zest, but little skill.","With zest but little skill, the youth drove.","With zest but little skill, the youth drove."
Five years he lived with a shaggy dog.,"With a shaggy dog, five years, he lived.","With a shaggy dog, five years, he lived. Yrsssss."
A fence cuts through the corner lot.,"Cuts through the corner lot, a fence does.","Hrrmmm. Cuts through the corner lot, a fence does. Hmm."
The way to save money is not to spend much.,"Not to spend much, the way to save money is.","Not to spend much, the way to save money is."
Shut the hatch before the waves push it in.,"Before the waves push it in, shut the hatch, you must.","Before the waves push it in, shut the hatch, you must."
The odor of spring makes young hearts jump.,"Makes young hearts jump, the odor of spring does.","Makes young hearts jump, the odor of spring does."
Crack the walnut with your sharp side teeth.,"With your sharp side teeth, crack the walnut, you must.","With your sharp side teeth, crack the walnut, you must."
He offered proof in the form of a lsrge chart.,"In the form of a large chart, proof he offered.","In the form of a large chart, proof he offered. Hrmmm."
Send the stuff in a thick paper bag.,"In a thick paper bag, send the stuff, you must.","In a thick paper bag, send the stuff, you must. Hmm."
A quart of milk is water for the most part.,"Water for the most part, a quart of milk is.","Water for the most part, a quart of milk is."
They told wild tales to frighten him.,"Wild tales to frighten him, they told.","Wild tales to frighten him, they told."
The three story house was built of stone.,"Built of stone, the three-story house was.","Built of stone, the three-story house was. Yrsssss."
In the rear of the ground floor was a large passage.,"In the rear of the ground floor, a large passage was.","In the rear of the ground floor, a large passage was."
A man in a blue sweater sat at the desk.,"Sat at the desk, a man in a blue sweater did.","Sat at the desk, a man in a blue sweater did."
Oats are a food eaten by horse and man.,"Eaten by horse and man, oats are.","Eaten by horse and man, oats are."
Their eyelids droop for want. of sleep.,"For want of sleep, their eyelids droop.","For want of sleep, their eyelids droop. Of sleep."
The sip of tea revives his tired friend.,"Revives his tired friend, the sip of tea does.","Revives his tired friend, the sip of tea does. Yes, hrrrm."
There are many ways to do these things.,"To do these things, many ways there are.","To do these things, many ways there are. Yrsssss."
Tuck the sheet under the edge of the mat.,"Under the edge of the mat, the sheet tuck.","Under the edge of the mat, the sheet tuck."
A force equal to that would move the earth.,"Move the earth, a force equal to that would.","Move the earth, a force equal to that would."
We like to see clear weather.,"To see clear weather, we like.","To see clear weather, we like."
The work of the tailor is seen on each side.,"Is seen on each side, the work of the tailor is.","Is seen on each side, the work of the tailor is."
Take a chance and win a china doll.,"A chance take, and a china doll win, you will.","A chance take, and a china doll win, you will."
"Shake the dust from your shoes, stranger.","Shake the dust from your shoes, stranger, you must.","Shake the dust from your shoes, stranger, you must. Yrsssss."
She was kind to sick old people.,"Kind to sick old people, she was.","Kind to sick old people, she was."
The dusty bench stood by the stone wall.,"By the stone wall, the dusty bench stood.","By the stone wall, the dusty bench stood."
The square wooden crate was packed to be shipped.,"Packed to be shipped, the square wooden crate was.","Packed to be shipped, the square wooden crate was. Yes, hrrrm."
We dress to suit the weather of most days.,"To suit the weather of most days, we dress.","Hrrmmm. To suit the weather of most days, we dress. Hmm."
Smile when you say nasty words.,"When nasty words you say, smile, you must.","When nasty words you say, smile, you must."
A bowl of rice is free with chicken stew.,"Free with chicken stew, a bowl of rice is.","Free with chicken stew, a bowl of rice is. Hrmmm."
The water in this well is a source of good health.,"Source of good health, the water in this well is.","Source of good health, the water in this well is. Hrmmm."
"Take shelter in this tent, but keep still.","Shelter in this tent take, but keep still, you must.","Shelter in this tent take, but keep still, you must."
That guy is the writer of a few banned books.,"Writer of a few banned books, that guy is.","Writer of a few banned books, that guy is. Hmm."
The little tales they tell are false.,"False, the little tales they tell are.","False, the little tales they tell are."
"The door was barred, locked, and bolted as well.","Barred, locked, and bolted, the door was.","Barred, locked, and bolted, the door was. Yes, hrrmmm."
Ripe pears are fit for a queen's table.,"Fit for a queen's table, ripe pears are.","Fit for a queen's table, ripe pears are."
A big wet stain was on the round carpet.,"On the round carpet, a big wet stain was.","On the round carpet, a big wet stain was."
"The kite dipped and swayed, but stayed aloft.","Dipped and swayed, the kite did, but aloft it stayed.","Dipped and swayed, the kite did, but aloft it stayed."
The pleasant hours fly by much too soon.,"Fly by much too soon, the pleasant hours do.","Fly by much too soon, the pleasant hours do."
The room was crowded with a wild mob.,"Crowded with a wild mob, the room was.","Crowded with a wild mob, the room was. Yrsssss."
This strong arm shall shield your honor.,"Shield your honor, this strong arm shall.","Shield your honor, this strong arm shall."
She blushed when he gave her a white orchid.,"Blushed when he gave her a white orchid, she did.","Blushed when he gave her a white orchid, she did."
The beetle droned in the hot June sun.,"In the hot June sun, the beetle droned.","In the hot June sun, the beetle droned. Yes, hrrrm."
Press the pedal with your left foot.,"With your left foot, the pedal press, you must.","With your left foot, the pedal press, you must."
Neat plans fail without luck.,"Without luck, neat plans fail.","Without luck, neat plans fail."
The black trunk fell from the landing.,"From the landing, the black trunk fell.","From the landing, the black trunk fell."
The bank pressed for payment of the debt.,"For payment of the debt, the bank pressed.","For payment of the debt, the bank pressed."
The theft of the pearl pin was kept secret.,"Kept secret, the theft of the pearl pin was.","Hrrmmm. Kept secret, the theft of the pearl pin was."
Shake hands with this friendly child.,"With this friendly child, shake hands, you will.","With this friendly child, shake hands, you will. Yes, hrrrm."
The vast space stretched into the far distance.,"Into the far distance, the vast space stretched.","Into the far distance, the vast space stretched."
A rich farm is rare in this sandy waste.,"Rare in this sandy waste, a rich farm is.","Rare in this sandy waste, a rich farm is."
His wide grin earned many friends.,"Earned many friends, his wide grin did.","Hrrmmm. Earned many friends, his wide grin did. Yes, hrrmmm."
Flax makes a fine brand of paper.,"Makes a fine brand of paper, flax does.","Makes a fine brand of paper, flax does."
Hurdle the pit with the aid of a long pole.,"Hurdle the pit with the aid of a long pole, you must.","Hurdle the pit with the aid of a long pole, you must."
A strong bid may scare your partner stiff.,"A strong bid may scare your partner stiff, it can.","A strong bid may scare your partner stiff, it can."
Even a just cause needs power to win.,"Power to win, even a just cause needs.","Power to win, even a just cause needs. Yes, hrrrm."
Peep under the tent and see the clowns.,"Under the tent peep, and the clowns see, you must.","Under the tent peep, and the clowns see, you must."
The leaf drifts along with a slow spin.,"Along with a slow spin, the leaf drifts.","Along with a slow spin, the leaf drifts."
Cheap clothes are flashy but do not last.,"Flashy but do not last, cheap clothes are.","Flashy but do not last, cheap clothes are. Yrsssss."
A thing of small note can cause despair.,"Of small note, a thing can cause despair.","Of small note, a thing can cause despair."
Flood the mails with requests for this book.,"With requests for this book, flood the mails you will.","With requests for this book, flood the mails you will. Yes, hrrmmm."
A thick coat of black paint covered all.,"Covered all, a thick coat of black paint did.","Covered all, a thick coat of black paint did."
The pencil was cut to be sharp at both ends.,"Sharp at both ends, the pencil was cut to be.","Sharp at both ends, the pencil was cut to be. Yes, hrrrm."
Those last words were a strong statement.,"A strong statement, those last words were.","A strong statement, those last words were."
He wrote his name boldly at the top of tile sheet.,"Boldly at the top of the sheet, his name he wrote.","Boldly at the top of the sheet, his name he wrote."
Dill pickles are sour but taste fine.,"Sour but taste fine, dill pickles do.","Sour but taste fine, dill pickles do. Hrmmm."
Down that road is the way to the grain farmer.,"The way to the grain farmer, down that road is.","The way to the grain farmer, down that road is. Yrsssss."
Either mud or dust are found at all times.,"At all times, either mud or dust are found.","At all times, either mud or dust are found. Yes, hrrrm."
The best method is to fix it in place with clips.,"Fix it in place with clips, the best method is.","Fix it in place with clips, the best method is. Hmm."
If you mumble your speech will be lost.,"Mumble your speech, and lost it will be.","Mumble your speech, and lost it will be. Yes, hrrrm."
At night the alarm roused him from a deep sleep.,"From a deep sleep, at night, the alarm roused him.","From a deep sleep, at night, the alarm roused him. Hmm."
Read just what the meter says.,"Just what the meter says, read, you must.","Just what the meter says, read, you must."
Fill your pack with bright trinkets for the poor.,"With bright trinkets for the poor, fill your pack, you must.","With bright trinkets for the poor, fill your pack, you must."
The small red neon lamp went out.,"Out, the small red neon lamp went.","Out, the small red neon lamp went."
"Clams are small, round, soft, and tasty.","Small, round, soft, and tasty, clams are.","Small, round, soft, and tasty, clams are. Hrmmm."
The fan whirled its round blades softly.,"Whirled its round blades softly, the fan did.","Whirled its round blades softly, the fan did."
The line where the edges join was clean.,"Clean, the line where the edges join was.","Clean, the line where the edges join was."
Breathe deep and smell the piny air.,"Deep, breathe, and the piny air smell.","Deep, breathe, and the piny air smell. Yes, hrrmmm."
It matters not if he reads these words or those.,"Matters not, if these words or those he reads.","Matters not, if these words or those he reads. Hmm."
A brown leather bag hung from its strap.,"Hung from its strap, a brown leather bag did.","Hung from its strap, a brown leather bag did."
A toad and a frog are hard to tell apart.,"Hard to tell apart, a toad and a frog are.","Hard to tell apart, a toad and a frog are. Yrsssss."
A white silk jacket goes with any shoes.,"With any shoes, a white silk jacket goes.","With any shoes, a white silk jacket goes. Yrsssss."
A break in the dam almost caused a flood.,"Almost caused a flood, a break in the dam did.","Almost caused a flood, a break in the dam did."
Paint the sockets in the wall dull green.,"Dull green, paint the sockets in the wall, you must.","Dull green, paint the sockets in the wall, you must."
The child crawled into the dense grass.,"Into the dense grass, the child crawled.","Into the dense grass, the child crawled."
Bribes fail where honest men work.,"Where honest men work, bribes fail.","Where honest men work, bribes fail. Hrmmm."
"Trample the spark, else the flames will spread.","Else the flames will spread, trample the spark, you must.","Else the flames will spread, trample the spark, you must."
The hilt. of the sword was carved with fine designs.,"Carved with fine designs, the hilt of the sword was.","The hilt. Carved with fine designs, the hilt of the sword was."
A round hole was drilled through the thin board.,"Through the thin board, a round hole was drilled.","Through the thin board, a round hole was drilled."
Footprints showed the path he took up the beach.,"Showed the path he took up the beach, footprints did.","Showed the path he took up the beach, footprints did. Hmm."
She was waiting at my front lawn.,"At my front lawn, waiting she was.","At my front lawn, waiting she was. Hmm."
A vent near the edge brought in fresh air.,"Fresh air, a vent near the edge brought in.","Fresh air, a vent near the edge brought in. Hmm."
Prod the old mule with a crooked stick.,"With a crooked stick, prod the old mule, you must.","With a crooked stick, prod the old mule, you must."
It is a band of steel three inches wide.,"A band of steel, three inches wide, it is.","A band of steel, three inches wide, it is. Yes, hrrmmm."
The pipe ran almost the length of the ditch.,"Almost the length of the ditch, the pipe ran.","Almost the length of the ditch, the pipe ran."
